N°,Tipo principal,Tipos secundarios,Fuente,Página web,Descripción,Sector principal,Subsectores,Organización,SubOrganización
50,Financiación,finance facility,The NDC Pipeline Accelerator Trust Fund,https://www.ndf.int/what-we-finance/projects/project-database/ndc-pipeline-accelerator-ndf-c98.html,The NDC Pipeline Accelerator Trust Fund is an IDB led climate finance facility aimed at fast tracking bankable and sustainable projects that move Latin America and the Caribbean closer to realising the targets of the 2015 Paris climate conference.,Desarrollo,"infrastructure, agriculture, and land-use management",Pública,public institution
51,Financiación,Mercados de carbono,Fondo Acción,https://fondoaccion.org/,"El Fondo Acción ha obtenido recursos de cooperación internacional y filantropía mediante una gestión de segundo piso que le ha permitido apoyar soluciones innovadoras y de alto valor en temas como desarrollo rural sostenible, conservación, cambio climático y protección y desarrollo de niños, niñas y adolescentes con énfasis en primera infancia. REDD+",Créditos de carbono,"Conservación in situ, Restauración, Modelos de producción sostenible",Privada,Privado
52,Financiación,financial support,The Just Transition Mechanism (JTM),https://commission.europa.eu/strategy-and-policy/priorities-2019-2024/european-green-deal/finance-and-green-deal/just-transition-mechanism_en,"The Just Transition Mechanism (JTM) is a key tool to ensure that the transition towards a climate-neutral economy happens in a fair way, leaving no one behind. I",Cambio climático,Just Transition Fund,Mixta,mix
53,Financiación,Call for Ideas,Global Innovation Lab for Climate Finance,https://www.climatefinancelab.org/call-for-ideas/,"The Lab's structure fosters cross-sector cooperation and enables solutions to overcome investment barriers. The Lab will select and develop eight innovative ideas to drive climate finance in 2026. This cycle will focus on regional programs, designed to draw on local expertise and address the unique financial and climate challenges in target countries.",Cambio climático,Adaptación y  mitigación,Mixta,mix
54,Financiación,Convocatoria y licitación,"La Organización de Estados Iberoamericanos para la Educación, la Ciencia y la Cultura (OEI)",https://oei.int/,"La Organización de Estados Iberoamericanos para la Educación, la Ciencia y la Cultura (OEI) es el mayor organismo de cooperación multilateral entre países iberoamericanos de habla española y portuguesa con presencia física en 20 países.   ",Desarrollo,"Educación, la ciencia y la cultura, estrategia digital, los derechos humanos, la democracia y la igualdad",Cooperación internacional,Cooperación multilateral
55,Oportunidades laborales,,Tropenbos international,https://www.tropenbos.org/,"We work with communities, companies, and governments across these focus areas: Community Forest Management, Restoration, Agroforestry and Wildfire Prevention",Ambiental,"Gestión comunitaria de bosques, la prevención de incendios, negocios y finanzas, y la inclusión de género y juventud",Organización sin fines de lucro (ONG),non-profit
56,Subvención,,La Fundación Ford,https://www.fordfoundation.org/,"We believe in the inherent dignity of all people. But around the world, too many people are excluded from the political, economic, and social institutions that shape their lives.",Desarrollo,"Gobierno democrático, equidad económica, educación, libertad de expresión, género y justicia reproductiva, derechos humanos, oportunidad metropolitana, desarrollo sostenible, y finanzas con impacto social.",Organización caritativa sin fines de lucro,"Organización caritativa privada, sin fines de lucro y no gubernamental"
57,Oportunidades laborales,"Finance & Investing, careers",The Nature Conservancy,https://www.nature.org/en-us/,"Protecting nature is an investment in our future.
The scale of conservation challenges across the globe requires new and bigger sources of funding. Working with investors, lenders and companies to identify the economic value of nature, we can secure financing and investments that extend the impact of our philanthropic support for the benefit of people and nature.",Cambio climático,"Organización ambiental de amplio alcance con la misión de conservar tierras y aguas, y proteger la biodiversidad. Con un enfoque y una amplia experiencia en proyectos de mitigación del uso de la tierra y adaptación basada en ecosistemas, agricultura climáticamente inteligente, restauración forestal, restauración de tierras degradadas, gestión del agua dulce y conservación marina",Organización sin fines de lucro (ONG),"Organización ambiental global, sin ánimos de lucro"
58,Oportunidades laborales,,World Wild Fund,https://www.worldwildlife.org/,"Our mission is to build a future in which people live in harmony with nature. To deliver this mission, we work to conserve and restore biodiversity, the web that supports all life on Earth; to reduce humanity's environmental footprint; and to ensure the sustainable use of natural resources to support current and future generations.",Ambiental,"Climate, forests, food, freshwater, wildlife, and oceans",Organización sin fines de lucro (ONG),"Organización internacional no gubernamental, independiente, apolítica y de conservación"
59,Oportunidades laborales,,Oréade-Brèche,https://oreade-breche.com/,"Oréade-Brèche es una consultora especializada en desarrollo y medio ambiente. Llevamos más de 40 años trabajando en proyectos nacionales, europeos e internacionales que abordan retos multisectoriales e involucran a actores de diversos niveles (político, institucional, local, etc.) que operan en los sectores público y privado.",Ambiental,"Biodiversidad y recursos naturales, Árboles y bosques, Agricultura sostenible, Territorios y Clima",Privada,Privada
60,Oportunidades laborales,,Organización de los Estados Americanos ,https://www.oas.org/es/,"La Organización de los Estados Americanos es el principal foro regional para el diálogo, análisis de políticas y toma de decisiones en asuntos del Hemisferio. La OEA reúne líderes de las naciones de las Américas para abordar temas y oportunidades de la región. Juntos, buscan el fomento de la  cooperación entre los Estados y el avance en una agenda regional común en materia de gobernabilidad democrática, derechos humanos, seguridad multidimensional y desarrollo sostenible.",Desarrollo,"Democracia, derechos humanos, seguridad y desarrollo integral. Algunas áreas específicas son el desarrollo humano, el comercio, la cultura, la energía sostenible, la gestión de riesgos, la seguridad cibernética y el control de drogas, entre otras",Organización internacional,Organización internacional de tipo regional y continental
61,Academia,Scholarships,VLIRUOS,https://www.vliruos.be/,"VLIRUOS is the leading funding body for scholarships for and partnerships between academics from Flanders and partner institutions in Africa, Latin America, and Asia, focused on global sustainable development.",Ambiental,Global sustainable development.,Organización sin fines de lucro (ONG),Organización sin fines de lucro
62,Financiación,financing mechanism and commodity initiatives,The Common Fund for Commodities (CFC),https://www.common-fund.org/,The Common Fund for Commodities (CFC) is an autonomous intergovernmental financial institution established within the framework of the United Nations. The Agreement Establishing the Common Fund for Commodities was negotiated in the United Nations Conference on Trade and Development (UNCTAD) from 1976 to 1980 and became effective in 1989. The first commodity development project was approved in 1991.,Rural,market access and development; agro-processing; product competitiveness; infrastructure; marketing and access to finance,Institución financiera,Institución financiera intergubernamental autónoma
63,Academia,research projects ,Hinrich Foundation ,https://www.hinrichfoundation.com/,"Hinrich Foundation is a unique Asia-based philanthropic organization that works to advance mutually beneficial and sustainable global trade. It believes sustainable global trade strengthens relationships between nations and improves people’s lives. It supports original research and education programmes that build understanding and leadership in global trade. Its approach is independent, fact-based and objective.",Desarrollo,"comercio, sostenibilidad y digitalización",Organización filantrópica,Organización filantrópica
64,Oportunidades laborales,,El Centro de Estudios Sociales de América Latina (CESAL) ,https://www.cesal.org/,"A nivel internacional impulsamos intervenciones que permiten el desarrollo humano de las personas más vulnerables en países de África, Latinoamérica y Oriente Medio. En España trabajamos apoyando a personas y familias en riesgo de exclusión social.",Desarrollo,"Gastronomía social, Desarrollo económico, Educación, Migración y Refugio, Medioambiente y Gobernabilidad y Derechos Humanos",Organización sin fines de lucro (ONG),Organización No Gubernamental
65,Subvención,,Pure Earth,https://www.pureearth.org/,"Pure Earth is a nonprofit environmental health organization committed to solving the global pollution crisis with practical, evidence-based solutions. We work to protect people—especially children and pregnant women—and the planet from the harmful effects of toxic pollution, with a current focus on reducing lead and mercury exposure in low- and middle-income countries.",Ambiental,"identify and implement solutions that stop toxic exposures, protect health, and restore environments.",Organización sin fines de lucro (ONG),nonprofit 
66,Licitación,,Mercy Corps,https://www.mercycorps.org.co/,"Somos una organización global (no gubernamental y sin ánimo de lucro) impulsada a creer en un mundo lleno de posibilidades.

Con más de 45 años de experiencia, seguimos trabajando para dar soluciones duraderas a las comunidades, y apoyarlas a pasar de la crisis a las oportunidades ante el conflicto, la migración y el cambio climático. ",Desarrollo,"conflicto, la migración y el cambio climático",Organización sin fines de lucro (ONG),no gubernamental y sin ánimo de lucro
67,Oportunidades laborales,,The Norwegian Refugee Council (NRC),https://www.nrc.no/,The Norwegian Refugee Council (NRC) is an independent humanitarian organisation helping people forced to flee. We protect displaced people and support them as they build a new future.,Desarrollo," food security, education, shelter, legal assistance, protection from violence, and water, sanitation and hygiene",Pública,independent humanitarian organisation 
68,Subvención,,The International Climate Fund (ICF) ,https://www.gov.uk/guidance/international-climate-finance,"The BEIS ICF Technical Assistance Programme aims to:
1. Contribute to the reduction of Colombia’s emissions and poverty reduction by improving the capacity and capability of key institutions (national, subnational, non-state).

2. Support demand-led technical assistance that prioritises implementation and helps raise climate ambition, by addressing barriers, constraints and areas of opportunity at different levels of government based on the country’s political and economic context and sectoral priorities.",Energía,"Diffusion of non-conventional renewable energy, energy efficiency market, Improving energy access, Sustainable tourism and scientific research ",Pública,Gobierno
69,Subvención,,UK PACT,https://www.ukpact.co.uk/," Supporting transformational climate change projects worldwide

UK Partnering for Accelerated Climate Transitions (UK PACT) is a programme funded by the UK Government. UK PACT supports countries that strive to overcome barriers to clean growth and have high emissions reduction potential to accelerate their climate change mitigation efforts.",Cambio climático,"Accelerating energy transitions, Sustainable Growth, Supporting green finance and financing green initiatives, Supporting partner countries through the transfer of skills",Pública,Gobierno
70,Subvención,,This National Institute for Health Research (NIHR),https://www.gov.uk/international-development-funding/health-service-delivery-and-resilience-in-the-context-of-extreme-weather-events-research-and-innovation,This National Institute for Health Research (NIHR) funding call is seeking research proposals to investigate how health services can adapt to disruption caused by extreme weather events in low and middle income countries.,Cambio climático,"Climate change, Environment, Health and Humanitarian emergencies/disasters ",Pública,Gobierno
71,Subvención,,GSMA Innovation Fund for Climate Resilience and Adaptation 2.0 ,https://www.gov.uk/international-development-funding/gsma-innovation-fund-for-climate-resilience-and-adaptation-2-dot-0,"The fund will provide 15 to 18 month grants to for-profit small and growing enterprises, including start-ups, that leverage mobile and digital technology to pilot or scale solutions that help communities in LMICs to build resilience towards the impact of climate change. ",Cambio climático,"digital technology, especially mobile, to improve resilience and adaptation to climate change",Pública,Gobierno
72,Subvención,,The Canada Fund for Local Initiatives (CFLI),https://www.international.gc.ca/world-monde/funding-financement/cfli-fcil/index.aspx?lang=eng,"The Canada Fund for Local Initiatives (CFLI) funds small, high-impact projects in over 120 countries that are eligible for Official Development Assistance (ODA). The CFLI has an annual budget of $26.8 million, with projects averaging $31,000 each. Local organizations plan and carry out projects, while the Canadian Embassy or High Commission selects and approves them.",Desarrollo,"Inclusive governance, including diversity, democracy, human rights, 2SLGBTQI+ rights and the rule of law, Gender equality, Peace and security, Environmental and climate action",Pública,Gobierno
73,Subvención,,Programa de las Naciones Unidas para el Desarrollo (PNUD),https://www.undp.org/es,"El mandato del PNUD es poner fin a la pobreza, construir una gobernanza democrática, un estado de derecho e instituciones inclusivas. Abogamos por el cambio y conectamos a los países con el conocimiento, la experiencia y los recursos para ayudar a las personas a construir una vida mejor.",Desarrollo,"Ambiente y Desarrollo Sostenible, Desarrollo Humano y Políticas, Desarrollo inclusivo, Gobernabilidad Democrática, Igualdad de género, Laboratorio de Aceleración, Programa de Pequeñas Donaciones (PPD)",Pública,Público
74,Oportunidades laborales,,La Organización Meteorológica Mundial (OMM),https://wmo.int/es,"La Organización Meteorológica Mundial (OMM) es el portavoz autorizado del sistema de las Naciones Unidas en todo lo concerniente al estado y el comportamiento de la atmósfera terrestre, su interacción con la tierra y los océanos, el tiempo y el clima que genera, y la consiguiente distribución de los recursos hídricos.",Ambiental,monitoreo y protección del clima y del medioambiente,Pública,Público
75,Oportunidades laborales,,Organización de las Naciones Unidas para el Desarrollo Industrial,https://www.unido.org/,"UNIDO is a specialized agency of the United Nations with a unique mandate to promote, dynamize and accelerate industrial development.  ",Desarrollo,"Supporting sustainable supply chains, Limiting climate breakdown, Ending hunger",Pública,Público
76,Oportunidades laborales,,Oficina de las Naciones Unidas para la Reducción del Riesgo de Desastres,https://www.undrr.org/es,"UNDRR es parte del sistema de las Naciones Unidas y es el punto focal para reducir el riesgo, convocar y coordinar actividades de reducción con miras a un futuro resiliente, y proteger los logros alcanzados hacia la consecución de los Objetivos de Desarrollo Sostenible (ODS).",Ambiental,"UNDRR trabaja en el punto de intersección entre la comprensión del riesgo, la reducción de las pérdidas que generan los desastres y la prevención de nuevos riesgos",Pública,Público
77,Proyectos,,Oficina de las Naciones Unidas de Servicios para Proyectos subvenciones,https://www.unops.org/es,"UNOPS proporciona soluciones prácticas de infraestructura, adquisiciones y gestión de proyectos. 

Junto con nuestros asociados, apoyamos proyectos de paz y seguridad, humanitarios y de desarrollo en todo el mundo, atendiendo necesidades vitales y ayudando a crear un futuro más sostenible, resiliente e inclusivo",Desarrollo,Proyectos de desarrollo o provee servicios especializados,Pública,Público
78,Financiación,,Fondo Colombia Sostenible,https://www.colombiasostenible.gov.co/fondo/,"Es un fondo multidonante con aportes de los Gobiernos de Noruega, Suecia y Suiza, bajo la administración del Banco Interamericano de Desarrollo (BID), que contribuye a reducir la deforestación, conservar la biodiversidad y aumentar la resiliencia y el desarrollo rural sostenible para mejorar las condiciones de vida de las comunidades rurales en zonas afectadas por la violencia.",Cambio climático,"Transformación ambiental y productiva, a la sostenibilidad y a la adaptación al cambio climático, a la equidad de género y al desarrollo con identidad de los grupos étnicos",Institución financiera,fondo multidonante
79,Oportunidades laborales,,El Proyecto Biocarbono Orinoquia,https://biocarbono.org/,"El Proyecto Biocarbono Orinoquia – Paisajes sostenibles bajos en carbono busca identificar y desarrollar alternativas que permitan contribuir con la mejora de las condiciones para la planificación y producción agropecuaria sostenible, con el fin de garantizar la disminución en las emisiones de Gases Efecto Invernadero. La iniciativa es liderada por el Gobierno nacional con apoyo del Banco Mundial y se implementa en los departamentos de Arauca, Casanare, Meta y Vichada.",Rural,"Promover una planeación integral del uso del suelo y mejoramiento de la gobernanza para el control de la deforestación, Implementar buenas prácticas de manejo sostenible del suelo, importantes para revertir su tendencia a la degradación, Definir el Programa de Reducción de Emisiones (PRE) y de Monitoreo, Reporte y Verificación (MRV) para la región.",Institución financiera,fondo multilateral del Banco Mundial
80,Financiación,,La Iniciativa del Fondo del BioCarbono para Paisajes Forestales Sostenibles (ISFL),https://www.biocarbonfund-isfl.org/,"La Iniciativa del Fondo del BioCarbono para Paisajes Forestales Sostenibles (ISFL) colabora con países de todo el mundo para reducir las emisiones del sector terrestre a través de políticas, prácticas y planificación del uso de la tierra más inteligentes.",Rural,"Uso de la tierra, principalmente la agricultura y la silvicultura, para reducir las emisiones de gases de efecto invernadero y promover el desarrollo bajo en carbono",Institución financiera,fondo multilateral
81,Financiación,,El Fondo Verde del Clima (GCF),https://www.greenclimate.fund/,"El Fondo Verde para el Clima (GCF) es el fondo climático mundial para los países en desarrollo. Movilizamos y entregamos capital a gran escala, fortalecemos instituciones, apoyamos cambios transformadores y unimos redes de colaboración para generar impacto",Energía,"energía e industria, transporte, uso de la tierra, bosques y ecosistemas, y seguridad humana",Institución financiera,fondo de financiamiento
82,Financiación,,The Global Environment Facility (GEF),https://www.thegef.org/who-we-are,"The Global Environment Facility has a unique governing structure organized around an Assembly, the Council, the Secretariat, 18 agencies, a Scientific and Technical Advisory Panel, and the Evaluation Office. The GEF serves as a financial mechanism for several environmental conventions. ",Cambio climático,"pérdida de biodiversidad, el cambio climático, la contaminación y la salud de los ecosistemas terrestres y marinos",Institución financiera,fondo de financiamiento
83,Financiación,,Fondo Internacional de Desarrollo Agrícola (FIDA),https://www.ifad.org/es/inicio,"La visión del Fondo Internacional de Desarrollo Agrícola es lograr economías rurales dinámicas, inclusivas y sostenibles, donde las personas no padezcan ni hambre ni pobreza.",Rural,"prosperidad, la seguridad alimentaria y la resiliencia al conectar a las personas pobres de las zonas rurales con la financiación, los mercados, la tecnología y los conocimientos que necesitan para hacer frente a las dificultades más importantes. ",Institución financiera,Fondo Internacional de Desarrollo Agrícola
84,Oportunidades laborales,,ONU-Habitat,https://onu-habitat.org/,"En ONU-Habitat trabajamos por un mejor futuro urbano. Con oficinas en más de 90 países, promovemos el desarrollo de asentamientos humanos social y ambientalmente sostenibles y nos esforzamos por lograr una mejor calidad de vida para todas las personas en las ciudades y comunidades.",Desarrollo,urbanización sostenible como motor del desarrollo y la paz,Pública,institución pública de las Naciones Unidas
85,Proyectos,,Asistencia Financiera No Reembolsable para Proyectos Comunitarios de Seguridad Humana - KUSANONE,https://www.colombia.emb-japan.go.jp/itpr_es/cooperacionKUSANONE.html,"A través del esquema de Asistencia Financiera No Reembolsable para Proyectos Comunitarios de Seguridad Humana - KUSANONE, Japón ofrece ayuda a organizaciones no gubernamentales o autoridades territoriales (gobernaciones y alcaldías) para solucionar problemas relacionados con la satisfacción de las necesidades humanas básicas fundamentales, en población vulnerable por factores socio-económicos determinables y víctimas del conflicto (desplazados, reinsertados y víctimas de minas antipersonal, entre otros).",Rural,"Desarrollo agropecuario, Bomberos, Educación, Salud, Capacitación.",Pública,Público
86,Subvención,,Partnerships for Forests,https://partnershipsforforests.com/,"Forests are essential for global development and preventing dangerous climate change but currently, markets fail to realise this.
We support partnerships that deliver on commitments for deforestation-free commodities, reduce the pressure on forests, and improve livelihoods.",Rural,forest landscape types,Pública,Público
87,Subvención,,Prince Albert II of Monaco Foundation,https://www.fpa2.org/en/index,"Through our work, the Prince Albert II of Monaco Foundation helps meet the Sustainable Development Goals set by the United Nations in the 2030 Agenda for Sustainable Development in order to build a world in which peace, justice and equality prevail for people and the Planet.",Cambio climático,"La limitación del cambio climático y la promoción de energías renovables, la conservación de la biodiversidad y la protección de los recursos hídricos y la lucha contra la desertificación",Privada sin fines de lucro (private nonprofit),organización privada sin fines de lucro
88,Subvención,,"Agencia Italiana de Cooperación al Desarrollo, AICS",https://bogota.aics.gov.it/es/home-spa/,"Agencia Italiana de Cooperación al Desarrollo, una entidad del gobierno italiano. Se dedica a la promoción del desarrollo internacional y la ayuda humanitaria en Colombia y Sudamérica, operando como una extensión de la política exterior italiana. ",Ambiental,"medio ambiente, desarrollo rural, empleabilidad y emprendimiento, y paz y educación",Pública,Público
89,Proyectos,,COOPI,https://www.coopi.org/en/country/colombia.html?ln=3,"COOPI orienta sus acciones a fortalecer las capacidades nacionales y locales en territorios estratégicos, con un enfoque integral y multisectorial que prioriza tanto la protección ambiental como la atención a poblaciones en situación de vulnerabilidad. La organización centra su labor en territorios de frontera, donde confluyen múltiples desafíos sociales, ambientales y humanitarios. Así mismo, COOPI trabaja fuertemente en asocio con organizaciones locales, con el fin de fortalecer los ecosistemas nativos como en la Amazonía colombiana y transfronteriza.",Desarrollo,"Economic development, water and sanitation, disaster preparedness and disaster risk reduction, education in emergency nutrition security, protection",Pública,Público
90,Financiación,,Oxfam,https://www.oxfam.org/es,"Oxfam es un movimiento mundial de personas que trabajan juntas para acabar con la injusticia de la pobreza. Junto a nuestras organizaciones socias, llevamos a cabo programas de desarrollo, hacemos campaña e incidencia política y proporcionamos ayuda humanitaria durante desastres y conflictos. Todo ello lo hacemos combinando y compartiendo estrategias prácticas con métodos innovadores.

Desde asegurar que las comunidades tengan servicios de saneamiento adecuados y agua potable para beber hasta lograr que más niñas vayan a la escuela, no nos detendremos hasta que cada persona en el planeta pueda disfrutar de una vida libre de pobreza. Estas son nuestras principales áreas de trabajo.",Cambio climático,"climate action, economic justice, and humanitarian response",Organización sin fines de lucro (ONG),organización no gubernamental (ONG) y sin fines de lucro
91,Financiación,,National Wildlife Federation (NWF),https://nwfactionfund.org/,"The National Wildlife Federation Action Fund is a nonprofit organization working to raise the visibility of key conservation issues with voters and elected officials. While affiliated with National Wildlife Federation, it is a separate and distinct entity. Through grassroots actions and focused legislative campaigns, the Action Fund advocates for solutions to protect, restore, and connect wildlife habitat; transform wildlife conservation; and connect Americans with wildlife.",Ambiental,"Wildlife Conservation, Climate, Water, Our Lands, Habitats, People & Justice",Privada sin fines de lucro (private nonprofit),organización privada sin fines de lucro
