N°,Tipo principal,Tipos secundarios,Fuente,Página web,Descripción,Sector principal,Subsectores,Organización,SubOrganización
1,Financiación,Inversión de impacto,SVX Colombia,https://svxcolombia.com/,SVX Colombia is an impact financial services firm that promotes purpose-driven investment in Colombia and the region. ,Finanzas,Finanzas,Organización sin fines de lucro (ONG),Organización sin fines de lucro
2,Subvención,Subvenciones,La Fundación Interamericana (IAF),https://www.iaf.gov/es/,La Fundación Interamericana (IAF) es un organismo independiente de ayuda exterior de EE.UU. creado por el Congreso en 1969 que invierte directamente en el desarrollo localizado liderado por la comunidad en toda América Latina y el Caribe,Desarrollo,"Desarrollo comunitario
Agricultura sostenible",Pública,Pública aunque independiente del gobiernos de los Estados Unidos
3,Cooperación internacional,Cooperación internacional,Agencia Española de Cooperación Internacional para el Desarrollo (AECID),https://www.aecid.es/inicio,"La AECID se define en la Ley de Cooperación como la agencia estatal adscrita al Ministerio de Asuntos Exteriores, Unión Europea y Cooperación, responsable del fomento, programación, coordinación operativa, gestión y ejecución de las políticas públicas de cooperación española para el desarrollo sostenible, acción humanitaria y educación para el desarrollo sostenible y la ciudadanía global.",Desarrollo,Fomentar el desarrollo sostenible,Pública,Pública
4,Financiación,Funding,The White Feather Foundation (TWFF),https://whitefeatherfoundation.com/,"We embrace environmental and humanitarian issues; and in conjunction with partners from around the world, we help to raise funds for the betterment of all life.",Ambiental,"For the Conservation of Life. Give access to clean water, provide educational opportunities and improve the health of those less fortunate. Protect and preserve our environment and Indigenous cultures.",Privada sin fines de lucro (private nonprofit),Private nonprofit 
5,Financiación,"Préstamos, subvenciones, fondos",Agence Française de Développement (AFD),https://www.afd.fr/es,"El Grupo AFD, compuesto por la Agence française de développement, Proparco y Expertise France, implementa la política de cooperación internacional definida por las autoridades francesas. ",Ambiental,ODS,Pública,Pública
6,Cooperación internacional,Cooperación internacional,Expertise France,https://www.expertisefrance.fr/en,Expertise France es una agencia internacional de cooperación al desarrollo que opera bajo los auspicios del gobierno francés.,Desarrollo,"Gobernanza, seguridad, clima, salud, educación, emprendimiento, industrias culturales y creativas, etc.",Pública,Pública
7,Academia,Convocatoria de investigación,"La Fundación ""la Caixa""",https://fundacionlacaixa.org/es/home,"Comprometida con el desarrollo socioeconómico del territorio desde sus inicios, la Fundación ”la Caixa” pronto proporcionó servicios en el ámbito social, cultural y cívico para mejorar la calidad de vida de las personas.",Ambiental,"Ciencia, cultura, medio ambiente, innovación social",Privada sin fines de lucro (private nonprofit),Privada de naturaleza no lucrativa
8,Subvención,Grants/Funding,The Rufford Foundation,https://www.rufford.org/,The Rufford Foundation is a UK registered charity which funds nature conservation projects across the developing world.,Ambiental,Nature conservation,Organización caritativa sin fines de lucro,Non-profit charity 
9,Subvención,Grants,Whitley Fund for Nature (WFN),https://whitleyaward.org/,"Whitley Fund for Nature (WFN) is a fundraising and grant-giving nature conservation charity, generously supported for more than 20 years by our Patron HRH The Princess Royal and WFN Ambassador and former Trustee Sir David Attenborough.",Ambiental,"Wildlife, landscapes, and people",Organización sin fines de lucro (ONG),Non-profit organization
10,Subvención,Grants,IDEA WILD,https://ideawild.org/,"IDEA WILD awards small equipment grants.
We receive equipment requests daily, 50 -70 requests/month, and prioritize them based on conservation impact, recipient need, and project location. Additional consideration is given to projects in areas identified as critical biodiversity hotspots.",Ambiental,"Biological research, conservation education, community outreach, conservation management, field training and professional development.",Organización sin fines de lucro (ONG),Non-profit organization
11,Financiación,"Funding, training, mentorship and continuous peer-to-peer support",Conservation Leadership Programme (CLP),https://www.conservationleadershipprogramme.org/,"Since 1985, CLP has been working to preserve biodiversity by funding and training early-career conservation leaders through our annual Team Awards",Ambiental,Conserve biodiversity and promote sustainable development locally,Privada,Private
12,Subvención,Grants,Wildlife Conservation Society,https://www.wcs.org/,The Wildlife Conservation Society saves wildlife and wild places around the world. WCS runs four zoos and an aquarium in New York and has global conservation programs in more than 50 countries.,Ambiental,"Saves wildlife and wild places worldwide through science, conservation action, education, and inspiring people to value nature",Organización sin fines de lucro (ONG),Non-profit organization
13,Subvención,"Grants, Careers, training",The United Nations Environment Programme (UNEP) ,https://www.unep.org/,"The United Nations Environment Programme (UNEP) is the United Nations’ leading global authority on the environment, driving transformational change on the triple planetary crisis: the crisis of climate change, the crisis of nature, land and biodiversity loss, and the crisis of pollution and waste.   ",Ambiental,"Climate action, Nature action and Chemicals and pollution action",Pública,Público
14,Academia,Careers,Rockefeller Philanthropy Advisors,https://www.rockpa.org/,"Rockefeller Philanthropy Advisors, our mission is to accelerate philanthropy in pursuit of a just world by providing deep global expertise to make philanthropy more thoughtful, equitable and effective.",Desarrollo,"Diversity, Equity, and Inclusion",Organización sin fines de lucro (ONG),Non-profit organization
15,Subvención,Grants,Fondation Segré,https://www.fondationsegre.org/,"Fondation Segré was established in 1996, initially with a very broad scope: to promote humanitarian, scientific, educational, artistic and environmental projects.",Ambiental,Conservation of nature and of biodiversity,Organización caritativa sin fines de lucro,Charity
16,Subvención,Grants,March Conservation Fund,https://marchconservationfund.org/,"Our work is focused on building the capacity of nonprofit operations, both domestically and abroad, to conserve populations of threatened birds and associated biodiversity.",Ambiental,"We expand protected areas, support ecological research, and empower the public to become stewards and advocates for the natural world.",Privada,private foundation
17,Academia,Careers,Fauna & Flora,https://www.fauna-flora.org/,"Fauna & Flora is an international wildlife conservation charity. We work closely with conservation partners in 48 countries to save nature, together.",Ambiental,"protecting and restoring habitats, saving species from extinction and developing sustainable livelihoods",Privada,company limited by guarantee
18,Subvención,Grants,The FairWays Foundation,https://thefairwaysfoundation.com/,"The FairWays Foundation recognizes water as Earth’s most vital resource—essential for life, biological processes, food production, and industry. Despite covering most of the planet, only a small percentage is accessible freshwater. ",Ambiental,"Water Conservation and Stewardship, Water Education and Habitat Conservation and Stewardship.",Organización sin fines de lucro (ONG),not-for-profit organization
19,Academia,"Careers, Funding",National Geographic Society,https://www.nationalgeographic.org/society/,"We fund individuals working on projects in science, conservation, storytelling, education, and technology that align with one or more of our focus areas.

And we don’t just support their incredible work. We actively seek to help them network, connect, and learn with National Geographic and each other, empower them with cutting-edge tools, technology, and training, and further their impact and recognition through our storytelling.",Ambiental,"science, conservation, storytelling, education, and technology",Organización sin fines de lucro (ONG),nonprofit organization
20,Financiación,"préstamos, donaciones y garantías",El Grupo Banco Interamericano de Desarrollo (Grupo BID),https://www.iadb.org/es,"Desde nuestra creación en 1959, hemos trabajado para mejorar la calidad de vida de millones de personas en nuestros 26 países miembros prestatarios en América Latina y el Caribe.

Brindamos apoyo financiero y técnico a gobiernos nacionales, subnacionales y otras entidades de la región. Llevamos a cabo investigaciones de vanguardia y desarrollamos soluciones innovadoras para enfrentar los desafíos del desarrollo, tanto a nivel local como global.",Cambio climático,"préstamos, donaciones y garantías, Abordar el cambio climático, Fortalecer el crecimiento sostenible
 ",Institución financiera,Organización financiera
21,Proyectos,"Projects, Careers, Funding",The Deutsche Gesellschaft für Internationale Zusammenarbeit (GIZ),https://www.giz.de/en,"The Deutsche Gesellschaft für Internationale Zusammenarbeit (GIZ) GmbH works worldwide for a future worth living. Together with our partners, we create opportunities and sustainably improve people’s lives. Through our networks, we turn international agendas into action – with a global vision and local impact.",Desarrollo,"Cooperation with the private sector, Making labour migration fair and A just transition – change that leaves no one behind",Privada,empresa público-privada con forma de sociedad de responsabilidad limitada (GmbH)
22,Proyectos,Projects,DAI,https://www.dai.com/,DAI works on the frontlines of global development. Transforming ideas into action—action into impact. We are committed to shaping a more livable world.,Desarrollo,"Climate, capital, digital acceleration, economic growth, education, environment, global health",Privada,Private
23,Academia,Career opportunities,baker hughes company,https://www.bakerhughes.com/,We are an energy technology company.  We understand the demands on energy. What it takes to produce it. How we make use of it. Why it’s essential to reduce its impact. Where we can change to achieve a sustainable balance.,Energía,"We develop and deploy the most advanced technologies to serve energy and industrial companies looking for more efficient, more reliable and cleaner solutions.",Privada,Private
24,Subvención,"Grants, Projects, Careers",The Global Environment Facility,https://www.thegef.org/,"The Global Environment Facility (GEF) includes several multilateral funds working together to address the planet's most pressing challenges in an integrated way. Its financing helps developing countries address complex challenges and work towards meeting international environmental goals. Over the past three decades, the GEF has provided more than $26 billion in financing, primarily as grants, and mobilized another $153 billion for country-driven priority projects. ",Ambiental,"Amazon, biodiversity, blended finance, food security, forest",Cooperación internacional,Cooperación internacional/Mixta
25,Subvención,Grants,TUI Care Foundation,https://www.tuicarefoundation.com/en,The TUI Forests programme puts forests at the centre of thriving communities and destinations. The programme will plant new trees and support local people to build thriving livelihoods through community managed tree nurseries and the creation of forest-based tourism experiences.,Ambiental,"supports and initiates projects which create new opportunities and contribute to thriving communities in tourism destinations all over the world. Connecting holidaymakers to good causes, it supports education and training opportunities for young people; drives the protection of natural habitats and the marine environment; and helps local communities to thrive sustainably and benefit from tourism",Pública,public benefit organization
26,Subvención,Grants,Turtle Conservation Fund (TCF),https://turtleconservationfund.org/homepage/,The Turtle Conservation Fund (TCF) is a strategizing and funding partnership coalition of leading turtle conservation organizations and individuals focused on ensuring the long-term survival of tortoises and freshwater turtles,Ambiental,To ensure that no species of tortoise or freshwater turtle becomes extinct and that sustainable populations of all species persist in the wild,Privada sin fines de lucro (private nonprofit),"private, non-profit organization"
27,Subvención,Grants,"The Conservation, Food & Health Foundation",https://cfhfoundation.grantsmanagement08.com/,"The Conservation, Food and Health Foundation seeks to protect the environment, improve food production, and promote public health in Africa, Asia, the Caribbean, Latin America, and the Middle East. ",Ambiental,"Conservation, Food, Health",Privada sin fines de lucro (private nonprofit),"private, non-profit foundation"
28,Subvención,Grants,La Iniciativa Internacional sobre el Clima (IKI),https://www.international-climate-initiative.com/en/,la Iniciativa Internacional sobre el Clima se ha convertido en un programa central para promover la acción climática y la conservación de la biodiversidad.,Cambio climático,"Mitigación de las emisiones de gases de efecto invernadero, Adaptación a los impactos del cambio climático, Preservar y restaurar los sumideros de carbono y Conservación de la diversidad biológica",Pública,Público
29,Academia,global knowledge and technical assistance program,The World Bank’s Energy Sector Management Assistance Program (ESMAP),https://www.esmap.org/ESMAP_At_A_Glance,"ESMAP's analytical and advisory services are seamlessly integrated with the World Bank's country financing and policy dialogue in the energy sector. Through the World Bank Group (WBG), ESMAP strives to expedite the energy transition necessary to achieve Sustainable Development Goal 7 (SDG7), which aims to ensure access to affordable, reliable, sustainable, and modern energy for all.",Energía,"Energy transition, closign the gender gap, energy data analytics, electricity access. Renewable energy",Pública,Public
30,Financiación,finance instruments,The Global Shield against Climate Risks,https://www.globalshield.org/,The aim of the Global Shield is to provide and facilitate more and better pre-arranged protection against climate and disaster related risks for vulnerable people and countries.,Cambio climático,The Global Shield against Climate Risks aims to support countries that are most vulnerable to climate risks.,Mixta,Mix
31,Financiación,finance instruments,The Renewable Energy and Energy Efficiency Partnership (REEEP),https://reeep.org/,REEEP has been advancing the deployment of reliable and affordable clean energy solutions in low- and middle-income countries for the benefit of last-mile customers and the most vulnerable populations.,Energía,"Facilitate reliable and affordable access to energy, Build up local financial ecosystems around clean energy investment, Support the Sustainable Development Goals (SDGs) and the Paris Agreement, Increase climate resilience through clean energy solutions, Catalyse social and equitable development through clean energy",Mixta,Mix
32,Academia,Careers,The U.S. Department of Energy’s Solar Energy Technologies Office (SETO),https://www.energy.gov/eere/solar/solar-energy-technologies-office,"The U.S. Department of Energy (DOE) has one of the richest and most diverse histories in the federal government. Although only in existence since 1977, the Department traces its lineage to the Manhattan Project effort to develop the atomic bomb during World War II and to the various energy-related programs that previously had been dispersed throughout various federal agencies. ",Ambiental,"Security and safety, scientific excellence, environment, energy access",Pública,Public
33,Financiación,"Funding, careers",The Green Climate Fund,https://www.greenclimate.fund/#,"GCF is the world’s climate fund for developing countries. We mobilise and deliver capital at scale, strengthen institutions and support transformative change, and bring together partnership networks to deliver impact.",Cambio climático,"Access funding
Simplified Approval Process
Project Preparation Facility
Project-specific Assessment Approach",Pública,public international organization
34,Financiación,Finance - carbon credits,The Clean Development Mechanism (CDM),https://unfccc.int/process-and-meetings/the-kyoto-protocol/mechanisms-under-the-kyoto-protocol/the-clean-development-mechanism,"The CDM allows emission-reduction projects in developing countries to earn certified emission reduction ( CER ) credits, each equivalent to one tonne of CO2 . These CER s can be traded and sold, and used by industrialized countries to a meet a part of their emission reduction targets under the Kyoto Protocol.",Créditos de carbono,certified emission reduction (CER ) credits (carbon credits),Pública,"public, intergovernmental framework"
35,Cooperación internacional,Cooperación internacional,The International Renewable Energy Agency (IRENA) ,https://www.irena.org/,"The International Renewable Energy Agency (IRENA) is a lead global intergovernmental agency for energy transformation that serves as the principal platform for international cooperation, supports countries in their energy transitions, and provides state of the art data and analyses on technology, innovation, policy, finance and investment.",Energía,Supporting countries worldwide in their transition to a sustainable energy future,Pública,"public, intergovernmental organization"
36,Financiación,instrumento financiero,Programa LIFE,https://cinea.ec.europa.eu/programmes/life_en,"Programa LIFE
Instrumento de financiación de la UE para el medio ambiente y la acción por el clima",Ambiental,"Naturaleza y biodiversidad, Economía circular y calidad de vida, Mitigación y adaptación al cambio climático, Transición a la energía limpia",Organización internacional,Unión Europea (UE)
37,Academia,Careers - Academia,European Research Council (ERC),https://erc.europa.eu/homepage,"El programa del Consejo Europeo de Investigación proporciona financiación atractiva de largo plazo para apoyar a excelentes investigadores e investigadoras y sus equipos con el objetivo de perseguir innovaciones de alto riesgo y de alto beneficio en cualquier campo de investigación, siendo la excelencia científica el único criterio de evaluación.",Desarrollo,"Social Sciences and Humanities, Physical Sciences and Engineering, Life Sciences",Pública,Public
38,Financiación,"Funding opportunities, Jobs for researchers",The Marie Skłodowska-Curie Actions,https://marie-sklodowska-curie-actions.ec.europa.eu/,"The Marie Skłodowska-Curie Actions fund excellent research and innovation and equip researchers at all stages of their career with new knowledge and skills, through mobility across borders and exposure to different sectors and disciplines.",Desarrollo,"academia, industry, and public outreach",Pública,Public
39,Subvención,Grants,"The European Climate, Infrastructure and Environment Executive Agency (CINEA)",https://cinea.ec.europa.eu/index_en,Supporting stakeholders in delivering the European Green Deal through high-quality programme management that helps to implement projects contributing to decarbonisation and sustainable growth.,Energía,"energy, environment, climate action, and transport.",Pública,public agency
40,Financiación,funding instrumen,The Connecting Europe Facility (CEF),https://cinea.ec.europa.eu/programmes/connecting-europe-facility_en,The Connecting Europe Facility (CEF) for Energy is the EU funding programme to implement the Trans-European Networks for Energy policy. It aims at supporting investments in building new cross-border energy infrastructure in Europe or rehabilitating and upgrading the existing one.,Desarrollo,"CEF is a key EU funding instrument to promote growth, jobs and competitiveness through targeted infrastructure investment at European level.",Pública,Public
41,Financiación,Funding,Horizon Europe,https://research-and-innovation.ec.europa.eu/funding/funding-opportunities/funding-programmes-and-open-calls/horizon-europe_en,"Horizon Europe is the EU’s key funding programme for research and innovation. Following the Multiannual Financial Framework Midterm Review (MTR) decision, the indicative funding amount for Horizon Europe for the period 2021-2027 is EUR 93.5 billion.",Cambio climático,"It tackles climate change, helps to achieve the UN’s Sustainable Development Goals and boosts the EU’s competitiveness and growth.",Pública,public funding programme
42,Financiación,Financing,Building Prospects,https://buildingprospects.fmo.nl/,"Building Prospects is the Dutch government fund for private investments in the agribusiness value chain, infrastructure and climate in developing countries.",Desarrollo,"agribusiness value chain, infrastructure and climate",Pública,Public
43,Subvención,Grants,The Innovation Facility,https://www.innovationfacility.org/,"The Innovation Facility is a grant-making programme targeting new types of nature-based carbon projects that, due to their innovative nature, do not yet receive sufficient finance via the Voluntary Carbon Market. The Facility will provide ramp-up finance for these projects. By doing so, they are intended to become investable for the private sector. All projects funded need to focus on nature-based activities that sequester CO2 from the atmosphere, combined with strong positive biodiversity impacts.",Ambiental,Nature-based approaches,Mixta,Mix
44,Financiación,Financing,Global Youth Climate Action Fund (GYCAF),https://gycaf.org/,"La acción climática liderada por jóvenes es cualquier iniciativa, actividad, proyecto o programa coordinado o dirigido por un individuo joven, una organización juvenil, una organización comunitaria o una empresa comercial que esté orientada a la adaptación y mitigación del cambio climático como enfoque principal de la organización o entidad (donde el propósito de fundar esta organización fue combatir solemnemente el cambio climático) o como enfoque secundario (donde el propósito de fundar esta organización fue comprometerse a reducir su huella de carbono).",Cambio climático,cambio climático,Privada,Privado
45,Proyectos,Projects,Better Living Initiatives - Global (BLI Global),https://www.bli-global.org/about-us/,"Better Living Initiatives - Global (BLI Global) is an international grassroots non profit organization focused on promoting solutions, improvements and initiatives to sustain better living conditions around the globe. Whether it is climate action and global warming, environment, education, health, empowerment of women, youth involvement or well being of children, our mission is to inspire global good. ",Cambio climático,"climate action and global warming, environment, education, health, empowerment of women, youth involvement or well being of children",Organización sin fines de lucro (ONG),international grassroots non profit organization
46,Academia,Careers,The Pisces Foundation,https://piscesfoundation.org/,"We partner with environmental leaders and organizations to strengthen the shared tools, resources, and connections that successful movements and advocates need",Cambio climático,"climate, conservation and environmental health and justice",Privada sin fines de lucro (private nonprofit),private non-profit organization
47,Subvención,programme grants,Oak Foundation,https://oakfnd.org/,"They are dedicated to supporting organisations to help people and communities thrive in just societies, where everyone is safe and has the opportunity to succeed. This also includes safeguarding our natural environment for future generations.",Ambiental,"Environment, Child Abuse Prevention, Housing and Homelessness, International Human Rights, Issues Affecting Women, and Learning Differences",Privada,private foundation
48,Financiación,risk capital,The Danish Climate Investment Fund (KIF),https://stateofgreen.com/en/solution-providers/the-danish-climate-investment-fund/,"The fund invests in projects, which directly or indirectly contribute to reduction of the emission of greenhouse gasses. We offer both share capital for the establishment of companies in collaboration with Danish businesses and we can co-invest in major climate projects which include Danish technology or know-how.",Cambio climático,"Buildings, Climate change adaptation, District energy, Smart energy systems, Waste management",Mixta,Mix
49,Financiación,"Funding, mobilizing investments",The Multilateral Fund for the Implementation of the Montreal Protocol,https://www.multilateralfund.org/,"The Fund has contributed to the successful implementation of the Montreal Protocol and gone beyond, catalysing social and environmental progress on a global scale. ",Cambio climático,"Our mission is to support developing (Article 5) countries in eliminating ozone-depleting substances and greenhouse gases, bolstering climate resilience, bettering public health, and cultivating a healthier, more livable world.",Pública,public fund
