N°,Tipo principal,Tipos secundarios,Fuente,Página web,Descripción,Sector principal,Subsectores,Organización,SubOrganización
92,Oportunidades laborales,,The Global Green Growth Institute (GGGI),https://gggi.org/,"The Global Green Growth Institute (GGGI) is a treaty-based international, inter-governmental organization dedicated to supporting and promoting strong, inclusive and sustainable economic growth in developing countries and emerging economies.",Finanzas,"Climate & Green Finance
Policy & Capacity
Circular Bioeconomy
Sustainable & Resilient Cities
Poverty & Gender",Pública,organización intergubernamental pública
93,Subvención,,Banco de Desarrollo de América Latina y el Caribe (CAF),https://www.caf.com/,"Somos un banco de desarrollo comprometido con apoyar a los países de América Latina y el Caribe y mejorar la calidad de vida en la región. Nuestras acciones promueven el desarrollo sostenible y la integración regional. Atendemos a los sectores público y privado, suministrando productos y servicios múltiples a una amplia cartera de clientes constituida por 24 países miembros, empresas privadas e instituciones financieras.",Desarrollo,"infraestructura, la agricultura, la educación, la salud y el sector privado",Institución financiera,banco de desarrollo
94,Proyectos,,La Fundación EPM,https://www.grupo-epm.com/site/fundacionepm/,"La Fundación EPM diseña y gestiona iniciativas que promueven la educación, la cultura, la innovación y la gestión social y ambiental, contribuyendo al desarrollo sostenible de los territorios. Con este enfoque, la Fundación EPM se consolida como un habilitador clave en los territorios, generando transformación social y ambiental alineada con su estrategia institucional, la sostenibilidad del Grupo EPM y los Objetivos de Desarrollo Sostenible (ODS). ",Desarrollo,"estión social y ambiental, servicios públicos domiciliarios, desarrollo humano y educación superior",Privada sin fines de lucro (private nonprofit),entidad privada sin ánimo de lucro
95,Subvención,,CIPE,https://www.cipe.org/,"CIPE crea nuevas oportunidades y ayuda a mejorar la vida de millones de personas. El liderazgo del sector privado y el compromiso con los principios democráticos son lo que hacen que los programas de CIPE sean tan únicos e impactantes, porque en la mayoría de los países y comunidades, las pequeñas y medianas empresas son el motor económico. ",Desarrollo,"Facilitación del comercio, economía digital y gobernanza, anticorrupción y cumplimiento, inversión responsable, empoderamiento económico, desarrollo de asocioaciones",Privada,Privado
96,Oportunidades laborales,,Sustainable Business Council (SBC),https://sbc.org.nz/,"SBC is a membership organisation that connects businesses, partners, and sectors to create impact that no single business could achieve alone. We work with executives and sustainability professionals to maximise their positive impact for shareholders, communities and the environment. We hold our members to account by asking them to fulfil member commitments. We deliver impact by championing our members to be at the leading-edge of sustainability and in doing so inspire other businesses to take action.",Energía,"energy, agriculture, transport, finance, manufacturing, tech, and retail.",Privada,Privado
97,Subvención,,Fundación Tinker,https://tinker.org/es/,"La Fundación ha canalizado más subvenciones hacia organizaciones de la sociedad civil con sede en Latinoamérica, respondiendo e invirtiendo en la visión de los actores locales que están trazando un camino para sus países y para la región. Un ejemplo notable ha sido el apoyo de la Fundación Tinker al movimiento latinoamericano judicial ad honorem de los últimos veinte años, que impulsó la segunda presidente de la Fundación Tinker, la Sra. Renate Rennie. Como parte de esa iniciativa, la Fundación Tinker apoyó a diversos abogados y actores que trabajan con incidencia política en toda la región que buscaban fortalecer el acceso a la justicia movilizando el talento y el tiempo de los colegios y asociaciones privadas de abogados en sus países.",Desarrollo,gobernanza democrática y educación,Privada,Privado
98,Financiación,,Makaia,https://makaia.org/,"Makaia es una organización sin fines de lucro con sede en Colombia, fundada con el propósito de generar capacidades de desarrollo social en América Latina a través de la tecnología, la innovación y la movilización de recursos.
Nuestra visión es alcanzar una sociedad en la que cada persona y organización disponga del conocimiento y la información necesarios para impulsar su propia transformación y la de sus comunidades, con el fin de mejorar la calidad de vida",Desarrollo,tecnología y estrategias de desarrollo social,Privada sin fines de lucro (private nonprofit),privada y sin ánimo de lucro
99,Subvención,,Fundación Biodiversidad ,https://fundacion-biodiversidad.es/,"Contribuir a revertir la pérdida de biodiversidad. Esto exige impulsar actuaciones en varios ámbitos a la vez, para conservar los ecosistemas sanos, restaurar los ecosistemas degradados, promover un uso sostenible de la biodiversidad y frenar las causas de su deterioro.",Ambiental,"protección de la naturaleza, la formación y sensibilización ambiental, la investigación, y la cooperación internacional",Pública,Público
100,Financiación,,Department for Energy Security & Net Zero (DESNZ),https://www.gov.uk/government/organisations/department-for-energy-security-and-net-zero,"Leading the government mission to achieve clean power by 2030 and accelerate to net zero: this will boost energy independence, protect billpayers, create growth and jobs and reduce carbon emissions",Energía,"energy security, supply, and markets, and industrial and building decarbonisation",Pública,Público
101,Oportunidades laborales,,Norwegian Church Aid,https://www.kirkensnodhjelp.no/en,"Norwegian Church Aid trabaja con personas y organizaciones de todo el mundo en su lucha por erradicar la pobreza y la injusticia. Ayudamos a quienes más lo necesitan, independientemente de su etnia, credo, afiliación política o religiosa.",Desarrollo,"gender-based violence, climate-resilient water, sanitation, and hygiene (CRWASH), peacebuilding, and economic development",Privada,Privada
